{
  "contract": "ai_daily_context",
  "protocol_version": 1,
  "request_id": "15151515-1515-4151-8151-151515151515",
  "work_dir": "\\\\fixture-server\\scanner fixtures\\工作 目录",
  "start_date": "2026-10-11",
  "end_date": "2026-10-11",
  "report_mode": "daily",
  "compression_profile": "daily_balanced_v1",
  "scan_db_path": "\\\\fixture-server\\scanner-state\\scan_index_v3.sqlite3",
  "scanner_settings": {},
  "adapters": {
    "office_worker_path": "\\\\fixture-server\\scanner-bin\\ai-daily-office-parser.exe",
    "python_executable": "\\\\fixture-server\\scanner-runtime\\python.exe",
    "python_module_root": "\\\\fixture-server\\scanner-repo",
    "python_document_worker_module": "src.workers.document_parser_worker"
  },
  "window_start_utc": "2026-10-10T16:00:00Z",
  "window_end_utc": "2026-10-11T16:00:00Z"
}
